Prodotto,Descrizione
Acutil55+,"ACUTIL ADULTI 55+ Vuoi mantenere giovane la tua vitalità? C'è un nuovo alleato per mente, ossa e muscoli. Compresse con Resveratrolo. Con Zinco, che contribuisce alla normale funzione cognitiva. Con Calcio e Magnesio, che contribuiscono al mantenimento di ossa normali e alla normale funzione muscolare. Con Vitamina B2, che contribuisce al mantenimento della normale capacità visiva. Supporta le esigenze nutrizionali specifiche in questa fascia di eta, insieme ad Acutil Adulti 55+, per mantenere mente e fisico sani e vitali. Le esigenze nutrizionali di ognuno di noi variano nelle diverse fasi della vita. Superati i 50 anni, il nostro corpo manifesta dei nuovi bisogni e diventa fondamentale garantire il corretto apporto di Vitamine e Minerali. Una dieta povera di questi nutrienti può influire sull'indebolimento muscolare e osseo, nonché aumentare la percezione di affaticamento mentale. ACUTIL ADULTI 55+ è un integratore con una formula specificamente studiata per gli adulti sopra i 55 anni, tenendo conto di tutti quei fattori alla base del mantenimento di un organismo sano e vitale, dalla mente fino alle ossa e ai muscoli. Scopriamoli tutti Vitamina B Le Vitamine B6 e B12 contribuiscono alla riduzione della stanchezza e dell'affaticamento; la Vitamina B2, contribuisce al mantenimento della normale capacità visiva. Zinco Un minerale coinvolto in vari processi fondamentali per l'organismo, per il corretto metabolismo di proteine, carboidrati e lipidi. Contribuisce alla normale funzione cognitiva e favorisce la rigenerazione dei tessuti. Calcio e Magnesio Contribuiscono al mantenimento di ossa normali e alla normale funzione muscolare. In particolare il magnesio rappresenta un minerale coinvolto in numerosi processi biologici ed una sua carenza si può manifestare con irritabilità e stanchezza. Spesso la lavorazione degli alimenti e la loro cottura diminuiscono la quantità di magnesio per porzione, rendendo difficile raggiungere la quantità giornaliera raccomandata. Selenio Il Selenio è un oligoelemento importante per difendere le cellule e proteggere l'organismo dai radicali liberi e responsabili dell'invecchiamento preservando l'elasticità dei tessuti. Gli integratori alimentari non vanno intesi come sostituti di una dieta variata, equilibrata e di un sano stile di vita. Modalità d'uso Assumere una compressa al giorno da deglutire con acqua preferibilmente al mattino. Una al giorno Fosfoserina Vitamina C Vitamina E Vitamina E Niacina Acido pantotenico Vitamina B6 Vitamina B2 Vitamina B1 Acido Folico Vitamina B12 Calcio Fosforo Magnesio Zinco Manganese Selenio Resveratrolo Componenti: Sali di calcio dell'acido ortofosforico, Ossido di magnesio, Vitamina C (Acido L-ascorbico), Vitamina E acetato (DL alfatocoferolo acetato), Agenti di rivestimento: Idrossipropilmetilcellulosa, Gommalacca, Acidi grassi, Cellulosa microcristallina; Agenti antiagglomeranti: Mono- e digliceridi degli acidi grassi, Biossido di silicio, Sali di magnesio degli acidi grassi, Carbossimetilcellulosa sodica reticolata; Niacina (Nicotinammide), Fosfoserina, Vitamina B6 (Cloridrato di piridossina), Acido Pantotenico (D-pantotenato, calcio), Agente di carica: cellulosa microcristalina; coloranti: E 171, E 102, E 110; Vitamina B1 (Tiamina mononitrato), Carbonato di manganese, Vitamina B2 (Riboflavina), Ossido di zinco, Resveratrolo, Vitamina B12 (Cianocobalamina), Folato (Acido pteroil monoglutammico), Selenito di sodio. Avvertenze: Gli integratori non vanno intesi come sostituti di una dieta variata, equilibrata e di un sano stile di vita. Tenere fuori dalla portata dei bambini al di sotto dei tre anni di età. Non superare la dose giornaliera consigliata. Il prodotto contiene i coloranti E 102 e E 110, che possono influire negativamente sull'attenzione e sull'attività dei bambini. Funzione cognitiva, Benessere, Vitalità. Numero verde gratuito."
Energya,"ENERGYA ENERGYA ESTATE ENERGYA 50 ENERGYA DIFESA L'INTEGRATORE DI CARICA PAPAYA + POTASSIO E MAGNESIO L'integratore di Magnesio e Potassio + Carica Papaya che contribuisce a ridurre stanchezza e affaticamento con la Speciale formula CPM. Per recuperare le energie anche nei giorni piu caldi. Per reintegrare i sali minerali. Per il benessere della funzione muscolare. SENZA GLUTINE Modalità d'uso: Il prodotto si presenta come una polvere finemente granulata, facilmente e rapidamente solubile. Sciogliere il contenuto di una bustina in un bicchiere d’acqua (150 ml) e mescolare bene. Assumere due bustine al giorno. Composizione: Papaya fermentata (Carica papaya L., frutto; destrosio) in polvere; Citrato di magnesio; Citrato di potassio; Maltodestrine da mais; Aroma; Correttore di acidità: acido citrico; Agente antiagglomerante: biossido di silicio; Edulcorante: sucralosio; Estratto di cartamo. Senza glutine. Modalità di conservazione: Conservare in luogo fresco e asciutto, a temperatura non superiore ai 25 °C, al riparo dalla luce, dall’umidità e da fonti dirette di calore. La data di fine validità si riferisce al prodotto in confezione integra, correttamente conservato. Eventuali leggere variazioni di colore e gusto, sono legate alla normale variabilità degli ingredienti di origine vegetale e non sono indice di alterazione della qualità del prodotto. Avvertenze: Non superare la dose giornaliera consigliata. Tenere fuori dalla portata dei bambini al di sotto dei tre anni di età. Gli integratori alimentari non vanno intesi come sostituti di una dieta variata, equilibrata e di un sano stile di vita. Per i bambini e per le donne in gravidanza o durante l’allattamento, si consiglia di consultare il proprio medico prima di assumere il prodotto. Magnesio Citrato: la forma di magnesio più biodisponibile rispetto alle altre tipologie, è un minerale essenziale coinvolto in molti processi biologici. Contribuisce alla riduzione di stanchezza e affaticamento, al normale metabolismo energetico e sostiene il normale funzionamento del sistema nervoso. Potassio: è un minerale molto diffuso all’interno delle cellule, dove è coinvolto in numerosi processi fisiologici, tra cui il normale funzionamento del sistema nervoso, della funzione muscolare e al mantenimento della normale pressione sanguigna. Carica Papaya Fermentata: ha una funzione antiossidante, utile nei periodi di stanchezza e maggior stress psico-fisico. La Papaya Fermentata pura viene essiccata con il metodo FBD, processo produttivo che preserva i principi funzionali della Papaya. Per recuperare le energie Quando fa molto caldo Per la normale funzione muscolare Più di 50 anni Periodi caldi Nei periodi di particolare stress e affaticamento. anche per questo"
ThermaCare,"VERSATILE XL PER IL DOLORE DIFFUSO per il trattamento dei dolori della coscia e della parte alta e centrale della schiena Le autoriscaldanti Versatile XL sono particolarmente adatte al trattamento di zone di dolore più diffuso. Le con 13 celle di calore brevettate possono essere usate in maniera flessibile e aderiscono delicatamente alla pelle tramite quattro punti adesivi. 8 ore di calore terapeutico. Area riscaldata Aree adesive Adatta per aree del corpo più ampie AUTORISCALDANTI VERSATILE XL Aprire la confezione ermetica della fascia autoriscaldante solo nel momento immediatamente precedente all'uso. Non appena le celle di calore entrano in contatto con l'ossigeno, la fascia si riscalda entro 30 minuti. Rimuovere la pellicola protettiva dalla fascia autoriscaldante ed esporre le 4 aree adesive. Assicurarsi di non toccare le superfici adesive in modo da non ridurne l'adesività. Rimuovere gli indumenti dalla parte superiore del corpo e posizionare delicatamente la fascia autoriscaldante, con la superficie adesiva rivolta verso la pelle, sopra l'area dolente delle spalle, della colonna vertebrale o della parte superiore della schiena; fissare le 2 superfici adesive superiori sulla pelle, procedendo dall'alto verso il basso. Fissare le 2 superfici adesive inferiori con il retro della mano, procedendo dal basso verso l'alto, per garantire la tenuta ottimale della fascia autoriscadante. Grazie alla forma ergonomica, la fascia autoriscaldante può essere posizionata esattamente sulla zona dolente, per un’applicazione precisa e flessibile. Dopo circa 30 minuti, la fascia autoriscaldante raggiunge la temperatura terapeutica di circa 40°C, che rimane costante per il resto del periodo di trattamento indicato. Per un effetto ideale, indossare la fascia autoriscaldante Versatile XL per un massimo di 8 ore. Quando si usano le autoriscaldanti Versatile ? I primi segni di dolore o tensione andrebbero trattati in maniera tempestiva, prima che si trasformino in un disturbo costante che influisce sulla vita quotidiana. Le autoriscaldanti Versatile sono particolarmente adatte per alleviare dolori muscolari e articolari causati da: Tensione muscolare Artrite Sforzi eccessivi e stiramenti in via di guarigione Distorsioni Le autoriscaldanti possono essere usate su aree di dolore più diffuso. Le autoriscaldanti sono idonee al trattamento sia del dolore cronico sia occasionale. Non usare le autoriscaldanti su pelle malata, lesa o danneggiata, lividi e rigonfiamenti o in parti del corpo non sensibili al calore. Non utilizzare il prodotto su viso, testa, seno, dita, inguine, piedi o dita dei piedi. Non utilizzare il prodotto sulla parte posteriore delle ginocchia, sulla parte interna del braccio o sulle ascelle. Informazioni sul prodotto: Istruzioni per l'uso: Non riscaldare mai le autoriscaldanti ® in forno, forno a microonde o con qualsiasi altro mezzo – pericolo d’incendio! xl xl Per gli individui di età inferiore a 55 anni, è possibile indossare le Versatile durante la notte, poiché il rischio di ustioni cutanee aumenta con l’avanzare dell’età. I dati clinici hanno dimostrato che, dopo l’uso di ® nel corso della notte, al risveglio il dolore è significativamente ridotto e la flessibilità nettamente migliorata. In caso di gravidanza, consultare un medico prima dell’uso delle autoriscaldanti ®. In caso di diabete, problemi circolatori, cardiopatie o artrite reumatoide, consultare un medico prima di utilizzare le autoriscaldanti ® Versatile . Non inumidire né lavare le autoriscaldanti: le celle di calore perderanno efficacia. La loro funzione non è però inficiata dalla normale sudorazione corporea. Una sudorazione profusa, per esempio durante l’attività fisica, può allentare l’adesivo. Interrompere l’uso e consultare un medico qualora: si notasse fastidio, bruciore, gonfiore, arrossamento o qualsiasi altro cambiamento persistente a livello della pelle nella zona dove si è indossato il prodotto. il dolore aumentasse o rimanesse invariato dopo 7 giorni. Dimensioni della confezione: Le autoriscaldanti  Versatile XL sono disponibili nel formato da 2 pezzi. è un dispositivo medico. Donne bambini gravidanza. Durante la notte l'utilizzo è consentito solo a chi ha un età inferiore ai 55 anni. Medico."
Amuchina,"AMUCHINA Protezione DISINFETTANTE AMBIENTI OGGETTI TESSUTI E un Presidio Medico Chirurgico. Leggere attentamente le istruzioni d'uso. AMUCHINA, UNA DI FAMIGLIA Perché ti protegge e ti accompagna in ogni momento della vita, come solo chi ti ama sa fare. Oggi scopriamo la storia di Luca Per portare a Luca a tavola tutta la freschezza di frutta e verdura senza virus e batteri. AMUCHINA SOLUZIONE DISINFETTANTE CONCENTRATA GIOCANDO si impara. Per igienizzare i pavimenti su cui Luca si allena tutti i giorni. AMUCHINA IGIENIZZANTE PAVIMENTI FRESCHEZZA ALPINA CERCO PROTEZIONE PER Fuori casa per disinfettare gli oggetti che Luca tocca con le sue piccole mani. AMUCHINA SUPERFICI SPRAY LA CASA LA TAVOLA IL BUCATO LA PERSONA Vivi la casa pienamente, Addio germi e batteri, Il bucato Sempre al sicuro nei tuoi panni. La persona Proteggi la tua pelle. Guarda il nuovo spot Scopri lo spot completo Scoprilo qui Scopri perchè Scopri dove Con tutti gli ambienti a tavola solo il meglio. panni. dentro e fuori igienizzati Ti prendi davvero cura della tua casa?"
Tachipirina,"La formulazione Tachipirina è una soluzione orale contenente paracetamolo, un principio attivo noto per la sua azione antipiretica e analgesica. Utilizzato principalmente per trattare stati febbrili e dolori di varia natura, è comunemente impiegato nei bambini con peso inferiore a 12 kg. Tuttavia, vi sono diverse controindicazioni e precauzioni da considerare prima dell'uso. Prima di utilizzare Tachipirina, è essenziale verificare l'assenza di allergie al paracetamolo o ad altri componenti della formulazione. Inoltre, condizioni mediche preesistenti come gravi patologie epatiche o anemia emolitica costituiscono controindicazioni all'uso del farmaco. È fondamentale consultare un medico in caso di dubbi o preoccupazioni riguardo all'idoneità dell'uso del medicinale, specialmente in presenza di condizioni specifiche come bulimia, cachessia o malnutrizione cronica. L'uso prolungato o in dosi elevate di Tachipirina può comportare rischi per la salute, tra cui disturbi del fegato e alterazioni renali. Pertanto, è consigliabile un monitoraggio regolare della funzionalità epatica e renale durante il trattamento. Inoltre, l'interazione con altri farmaci deve essere attentamente valutata, specialmente quelli che influenzano la funzionalità epatica o la coagulazione del sangue. La corretta somministrazione di Tachipirina nei bambini richiede una valutazione accurata del peso corporeo e il rispetto delle dosi raccomandate in base a esso. È importante seguire scrupolosamente le istruzioni per evitare sovradosaggi o errori di dosaggio, che potrebbero comportare gravi conseguenze per la salute. In caso di ingestione accidentale di dosi eccessive, è necessario ricorrere immediatamente a un intervento medico. Gli effetti indesiderati associati all'uso di Tachipirina possono includere reazioni allergiche, disturbi ematici, compromissione della funzionalità epatica e renale, nonché reazioni cutanee gravi. È importante essere consapevoli di tali potenziali rischi e segnalare tempestivamente eventuali effetti indesiderati al medico o al farmacista. Per garantire l'efficacia e la sicurezza del trattamento, è essenziale conservare correttamente Tachipirina e rispettare il periodo di validità dopo la prima apertura. Inoltre, la corretta eliminazione dei farmaci non utilizzati è fondamentale per prevenire danni all'ambiente. Infine, è consigliabile consultare sempre il foglietto illustrativo del prodotto per ulteriori informazioni e istruzioni specifiche sull'uso e la conservazione del medicinale."